<?xml version="1.0" encoding="UTF-8" ?>
<data-crow-objects xmlns:xsi="http://www.w3.org/2001/XMLSchema-instance" xsi:noNamespaceSchemaLocation="games-export.xsd">
    <software-item>
        <item>Software</item>
        <available>true</available>
        <categories>
        </categories>
<categories-list></categories-list>
        <container>
        </container>
<container-list></container-list>
        <cooperative-multiplayer></cooperative-multiplayer>
        <countries>
        </countries>
<countries-list></countries-list>
        <created>2015-09-23</created>
        <days></days>
        <days-loaned></days-loaned>
        <description></description>
        <developers>
        </developers>
<developers-list></developers-list>
        <due-date></due-date>
        <ean></ean>
        <filehash></filehash>
        <filehash-type></filehash-type>
        <filename></filename>
        <filesize></filesize>
        <id>00a34000-fded-443f-a5bf-05df96a48f6c</id>
        <item>Software</item>
        <item-value></item-value>
        <label>Red Ocean</label>
        <languages>
        </languages>
<languages-list></languages-list>
        <lend-by></lend-by>
        <license></license>
        <loan-end-date></loan-end-date>
        <loan-start-date></loan-start-date>
        <loan-status>Available</loan-status>
        <modified>2015-09-23</modified>
        <multiplayer-game></multiplayer-game>
        <picture-back></picture-back>
        <picture-cd></picture-cd>
        <picture-front></picture-front>
        <platform></platform>
        <publishers>
        </publishers>
<publishers-list></publishers-list>
        <rating></rating>
        <screenshot-one></screenshot-one>
        <screenshot-three></screenshot-three>
        <screenshot-two></screenshot-two>
        <serial-key></serial-key>
        <service></service>
        <service-url></service-url>
        <state>
        </state>
<state-list></state-list>
        <storage-medium></storage-medium>
        <tags>
            <tag>
                <name>trekstor/games_1</name>
            </tag>
        </tags>
<tags-list>trekstor/games_1</tags-list>
        <title>Red Ocean</title>
        <user-long-text-field></user-long-text-field>
        <user-numeric-field-1></user-numeric-field-1>
        <user-numeric-field-2></user-numeric-field-2>
        <user-short-text-field-1></user-short-text-field-1>
        <user-short-text-field-2></user-short-text-field-2>
        <version></version>
        <webpage></webpage>
        <year></year>
    </software-item>
    <software-item>
        <item>Software</item>
        <available>true</available>
        <categories>
        </categories>
<categories-list></categories-list>
        <container>
        </container>
<container-list></container-list>
        <cooperative-multiplayer></cooperative-multiplayer>
        <countries>
        </countries>
<countries-list></countries-list>
        <created>2015-09-23</created>
        <days></days>
        <days-loaned></days-loaned>
        <description></description>
        <developers>
        </developers>
<developers-list></developers-list>
        <due-date></due-date>
        <ean></ean>
        <filehash></filehash>
        <filehash-type></filehash-type>
        <filename></filename>
        <filesize></filesize>
        <id>040ddce9-77c4-404a-b9f8-275aa46146f1</id>
        <item>Software</item>
        <item-value></item-value>
        <label>Sins of a Solar Empire</label>
        <languages>
        </languages>
<languages-list></languages-list>
        <lend-by></lend-by>
        <license></license>
        <loan-end-date></loan-end-date>
        <loan-start-date></loan-start-date>
        <loan-status>Available</loan-status>
        <modified>2015-09-23</modified>
        <multiplayer-game></multiplayer-game>
        <picture-back></picture-back>
        <picture-cd></picture-cd>
        <picture-front></picture-front>
        <platform></platform>
        <publishers>
        </publishers>
<publishers-list></publishers-list>
        <rating></rating>
        <screenshot-one></screenshot-one>
        <screenshot-three></screenshot-three>
        <screenshot-two></screenshot-two>
        <serial-key></serial-key>
        <service></service>
        <service-url></service-url>
        <state>
        </state>
<state-list></state-list>
        <storage-medium></storage-medium>
        <tags>
            <tag>
                <name>trekstor/games_3</name>
            </tag>
        </tags>
<tags-list>trekstor/games_3</tags-list>
        <title>Sins of a Solar Empire</title>
        <user-long-text-field></user-long-text-field>
        <user-numeric-field-1></user-numeric-field-1>
        <user-numeric-field-2></user-numeric-field-2>
        <user-short-text-field-1></user-short-text-field-1>
        <user-short-text-field-2></user-short-text-field-2>
        <version></version>
        <webpage></webpage>
        <year></year>
    </software-item>
    <software-item>
        <item>Software</item>
        <available>true</available>
        <categories>
        </categories>
<categories-list></categories-list>
        <container>
        </container>
<container-list></container-list>
        <cooperative-multiplayer></cooperative-multiplayer>
        <countries>
        </countries>
<countries-list></countries-list>
        <created>2015-09-23</created>
        <days></days>
        <days-loaned></days-loaned>
        <description></description>
        <developers>
        </developers>
<developers-list></developers-list>
        <due-date></due-date>
        <ean></ean>
        <filehash></filehash>
        <filehash-type></filehash-type>
        <filename></filename>
        <filesize></filesize>
        <id>04128f95-301c-4786-87d6-679ba7c6b9d3</id>
        <item>Software</item>
        <item-value></item-value>
        <label>Need for Speed: Porsche Unleashed</label>
        <languages>
        </languages>
<languages-list></languages-list>
        <lend-by></lend-by>
        <license></license>
        <loan-end-date></loan-end-date>
        <loan-start-date></loan-start-date>
        <loan-status>Available</loan-status>
        <modified>2015-09-23</modified>
        <multiplayer-game></multiplayer-game>
        <picture-back></picture-back>
        <picture-cd></picture-cd>
        <picture-front></picture-front>
        <platform></platform>
        <publishers>
        </publishers>
<publishers-list></publishers-list>
        <rating></rating>
        <screenshot-one></screenshot-one>
        <screenshot-three></screenshot-three>
        <screenshot-two></screenshot-two>
        <serial-key></serial-key>
        <service></service>
        <service-url></service-url>
        <state>
        </state>
<state-list></state-list>
        <storage-medium></storage-medium>
        <tags>
            <tag>
                <name>trekstor/games_3</name>
            </tag>
        </tags>
<tags-list>trekstor/games_3</tags-list>
        <title>Need for Speed: Porsche Unleashed</title>
        <user-long-text-field></user-long-text-field>
        <user-numeric-field-1></user-numeric-field-1>
        <user-numeric-field-2></user-numeric-field-2>
        <user-short-text-field-1></user-short-text-field-1>
        <user-short-text-field-2></user-short-text-field-2>
        <version></version>
        <webpage></webpage>
        <year></year>
    </software-item>
    <software-item>
        <item>Software</item>
        <available>true</available>
        <categories>
        </categories>
<categories-list></categories-list>
        <container>
        </container>
<container-list></container-list>
        <cooperative-multiplayer></cooperative-multiplayer>
        <countries>
        </countries>
<countries-list></countries-list>
        <created>2015-09-23</created>
        <days></days>
        <days-loaned></days-loaned>
        <description></description>
        <developers>
        </developers>
<developers-list></developers-list>
        <due-date></due-date>
        <ean></ean>
        <filehash></filehash>
        <filehash-type></filehash-type>
        <filename></filename>
        <filesize></filesize>
        <id>04136ffe-9237-4bdc-b958-90170db139db</id>
        <item>Software</item>
        <item-value></item-value>
        <label>Need for Speed: Carbon</label>
        <languages>
        </languages>
<languages-list></languages-list>
        <lend-by></lend-by>
        <license></license>
        <loan-end-date></loan-end-date>
        <loan-start-date></loan-start-date>
        <loan-status>Available</loan-status>
        <modified>2015-09-23</modified>
        <multiplayer-game></multiplayer-game>
        <picture-back></picture-back>
        <picture-cd></picture-cd>
        <picture-front></picture-front>
        <platform></platform>
        <publishers>
        </publishers>
<publishers-list></publishers-list>
        <rating></rating>
        <screenshot-one></screenshot-one>
        <screenshot-three></screenshot-three>
        <screenshot-two></screenshot-two>
        <serial-key></serial-key>
        <service></service>
        <service-url></service-url>
        <state>
        </state>
<state-list></state-list>
        <storage-medium></storage-medium>
        <tags>
            <tag>
                <name>trekstor/games_3</name>
            </tag>
        </tags>
<tags-list>trekstor/games_3</tags-list>
        <title>Need for Speed: Carbon</title>
        <user-long-text-field></user-long-text-field>
        <user-numeric-field-1></user-numeric-field-1>
        <user-numeric-field-2></user-numeric-field-2>